{
  "id": "decision_manual_403_linked_001",
  "contract_version": "v1",
  "schema_url": "https://github.com/CloudSpaceLab/ai-logfixer/contracts/v1/schemas/investigation-decision.schema.json",
  "request_id": "req_manual_go_api_403_001",
  "decision": "link_related",
  "explanation": "The 403 request overlaps with an active go-api 503 investigation by service, deployment version, and time window, but it is not identical because 403 usually points to auth or policy while 503 points to availability.",
  "user_message": "I linked your 403 request to the active go-api incident and will track it as a focused auth/policy branch.",
  "cluster_id": "cluster_go_api_v42_001",
  "branch_id": "branch_go_api_403_auth_001",
  "capacity_snapshot": {
    "max_global_active_investigations": 5,
    "current_global_active_investigations": 2,
    "max_per_service_active_investigations": 2,
    "current_service_active_investigations": 1,
    "max_related_branches_per_cluster": 3,
    "current_related_branches": 2,
    "queue_limit": 20,
    "current_queue_depth": 0
  },
  "next_actions": [
    {
      "id": "next_open_branch",
      "label": "Open auth branch",
      "action_type": "open_investigation_branch",
      "description": "Open the linked 403 auth/policy branch.",
      "enabled": true
    }
  ],
  "created_at": "2026-05-21T08:06:00Z"
}
